{
  "$schema": "http://json-schema.org/draft-07/schema#",
  "$id": "https://boardgame-protocol.github.io/json-schemas/schemas/1.0.0/responses/get_state.json",
  "type": "object",
  "required": [
    "version",
    "game",
    "match_id",
    "status",
    "phase",
    "turn",
    "stage",
    "state",
    "active_agent_id",
    "agents",
    "started_at"
  ],
  "properties": {
    "version": {
      "type": "string",
      "pattern": "^\\d+\\.\\d+\\.\\d+$"
    },
    "type": {
      "type": "string",
      "const": "get_state_response"
    },
    "game": {
      "type": "string"
    },
    "match_id": {
      "type": "string"
    },
    "status": {
      "type": "string"
    },
    "phase": {
      "type": "string"
    },
    "turn": {
      "type": "integer",
      "minimum": 0
    },
    "stage": {
      "type": "string"
    },
    "state": {
      "type": "object",
      "required": [
        "version",
        "data"
      ],
      "properties": {
        "version": {
          "type": "string",
          "pattern": "^\\d+\\.\\d+\\.\\d+$"
        },
        "data": {
          "type": "object"
        }
      }
    },
    "active_agent_id": {
      "type": "string"
    },
    "agents": {
      "type": "array",
      "items": {
        "type": "object",
        "required": [
          "id",
          "name"
        ],
        "properties": {
          "id": {
            "type": "string"
          },
          "name": {
            "type": "string"
          }
        },
        "additionalProperties": false
      },
      "minItems": 1
    },
    "winners": {
      "type": "array",
      "items": {
        "type": "string"
      }
    },
    "started_at": {
      "type": "string",
      "format": "date-time"
    },
    "ended_at": {
      "type": "string",
      "format": "date-time"
    }
  },
  "additionalProperties": false
}